text,Joy,Fear,Anger,Sadness,Surprise
My parents were confused.,0,1,0,1,1
And made worse by her crying because of the embarrassment.,0,1,0,1,0
My car door was still open so running into the street after it like a moron i tried getting into the car and winded up missing and getting stuck half in the car and half out getting drug across the street and finally ending up in someones yard when the car came to a stop after rolling over my foot with the tire.,0,1,1,1,1
What demon likes peas?,0,0,0,0,1
What is even more interesting is that I know exactly how I got this definition.,1,0,0,0,1
"i crouched and put my arm on my knee, acting like a pro, like i was amazing.",1,0,0,0,0
"i just cracked my head into a glass door.A delivery person, instead of calling me and saying `` I've got a package. ''",0,1,1,0,0
My heart starts pounding just looking at it and all the thoughts of telling John to leave have wandered out of my head for the moment.,0,1,0,0,0
"I'm now really scared cuz it's moving faster and suddenly, this shadow seems to get out of a crouch position to stand up, and begins to flail it's limbs as it's running towards me.",0,1,0,0,1
I had just had a procedure done to implant an Intrathecal Baclofen Pump in my belly.,0,1,0,0,0
Silence echoed in my head.,0,1,0,1,0
"Additionally, there was snow on the ground outside, but we found no footprints around the house and no mud or water in the kitchen where the intruder had been walking.",0,1,0,0,1
"Brushing myself off, I ate one of the apples I had It wasn't until I felt cold that a hand touched my shoulder and caused me to jump.",0,1,0,0,1
Mile 20 my feet were starting to get mad.,0,1,0,0,0
"i didn't mind because the track was awesome and i wasn't too tired, i just had a huge blister on my thumb.",1,0,0,0,0
She left in a huge hurry leaving me with the overflowing toilet after her giant dump.,0,1,1,0,1
There was chinchilla poop *everywhere*.,0,1,1,0,1
"But she doesn't know how much I ache whenever she touches me with those hands, those eyes, those lips, that ache that connects my heart, my gut, and my cunt in one fell swoop.",0,0,1,1,0
I nodded my head excitedly.,1,0,0,0,0
"A flaming ball of FIRE shoots up my leg to my hip, back down and out my toes, and I involuntarily KICK HER!",0,1,1,0,1
I suffered from severe trauma as a child.,0,1,0,1,0
"the few movies that i have watched since then, i cried my eyes out.",0,0,0,1,0
"We went out for pizza, everything was grand -- great conversation, no awkwardness -- until a friend of hers came up and started chatting, and then congratulated her on her new boyfriend, etc.",1,1,0,1,1
BUT OH GOD MY NAILS ARE BLACK CALL A PRIEST.,0,1,0,0,1
pounding my fists and screaming to a god that is not there; it's sad there had to be a battle sad i had to loose.,0,1,1,1,0
Never found anything... kind of spooky.,0,1,0,0,1
He ran outside with it to find this man at the bottom of our driveway.,0,1,0,0,1
The shock burned a part of my thumb.,0,1,0,1,1
It buoyed up my heart.,1,0,0,0,0
"I went so crazy, that I trashed my wrists and bled to the point of fainting.",0,1,1,1,0
&lt;/crazy-nutter&gt;,0,1,0,0,1
I then pushed myself up using my arms.,0,0,0,0,0
"Yesterday my back stared killing me, by 4:30 the pain was unbearable.",0,1,0,1,0
It was funny because I thought I broke my arm.,1,1,0,0,1
I got lie after lie.,0,1,1,1,0
But it's a very strange feeling.,0,1,0,0,1
Ill pay you back!,1,0,0,0,0
Now i'm stuck with a Class D Felony for Distribution of Marijuana... fucking sucks man..,0,1,1,1,0
"I remember that the phrase ""blood turning to ice"" makes sense now.",0,1,0,0,1
I took my son and moved out and he moved in with her.,0,1,1,1,0
"She claimed I beat her, raped her, tortured, and abused her.",0,1,1,1,1
The hike was absolutely gorgeous with thousands of wildflowers blooming and waterfalls tumbling down the side of the gorge... and the view from the top was stunning with the river meandering out of the Gorge... the world resting at my feet.,1,0,0,0,0
"The form itself did not shed any light, but was light.",0,0,0,0,1
How often has this been available in the past and I hadn't known and ended up with a kink in my neck?,0,1,1,0,0
"I pulled it up, still heard the gushing sound, so I turned my head, and the other one stopped immediately.",0,1,0,0,0
under my skin the itch is unscratched.,0,1,0,0,0
I had two in a row.,0,0,0,0,0
My friends and I were at the beach a few weeks ago.,1,0,0,0,0
"In order to buy food at the festival, you have to go to a tent and buy food tickets.",0,0,0,0,0
"My stomach felt a bit queasy all day yesterday so it was difficult for me to eat a lot, but I managed to have half a banana and a lot of water immediately after the race.",0,1,0,1,0
Pretty much everyone objected to my wedding.,0,1,1,1,1
"My prep nurse Deborah ( went by Debbie ( Which I thought was great because I really wanted my mom with me, but it wasn't possible with a C-Section ) ) Held my hand and told me to sit very still.",0,1,0,0,0
My stomach must be returning to normal size after months of unnecessary stretching.,0,0,0,0,0
I shall now write an abridged version of the second chapter: Chapter 2 I blinked and rubbed my eyes.,0,0,0,0,0
"I now wore a 36B bra, and my waist was down to 25 inches, but she insisted.",0,0,0,0,0
I don't need this job and you know it.,0,0,1,0,0
We noped out of there pretty fast.,0,1,0,0,1
"My nose was mashed against my face, I was in complete darkness, and the only way to breathe was the oxygen coming in through that tiny eyelet at my mouth.",0,1,0,1,0
"I got my first raspberry from a crowd surfer falling and my face hitting the monitor, battle wounds.",0,1,0,1,1
And soon well need more cabbage and potatoes.,0,0,0,0,0
"Ok so here I am trying to just sit down and write some of the really neat things that floated through my head today at work, and as soon as I get to a point when I don't have someone staring at me, all that beautiful crap flies right out of my ear and goes away... I think I left the AC on again.",0,0,0,0,0
My feet still get rubbed at the end of the day and when we go out to eat its still my choice.,1,0,0,0,0
"After entering the park, I started running ( slowly ) again and managed to run ( slowly ) across the finish where a very young ( and very cute ) teenage boy put a medal around my neck.",1,0,0,0,0
"I see the match, held tightly in my hand.",0,0,0,0,0
"Is it too hard to forget someone from the past, i wish i could, but its very hard, I think my heart is too big and i have to much room.",0,0,0,1,0
Now when I have too much to do my brain just gets distracted by all the other jobs jostling for attention.,0,1,0,0,0
"Every single time I found a girl that I was interested in, they always ended up finding some creative way to break my heart.",0,0,1,1,0
I also noticed that last year my back was killing me and I was popping Ibuprofen all night.,0,1,0,1,0
"Despite my literal and non-literal `` growing up '' in another place, I had always felt a claim to Calgary, a belonging that wound deep through my bones.",1,0,0,0,0
He's just a super nice guy who wants to help girls out all while being respectful.,1,0,0,0,0
My eyes were staring at the floor as I said this.,0,1,0,1,0
"This'll probably get buried, but what the hell?",0,0,0,0,1
"All the while, my foot throbbing.",0,1,0,0,0
"I would wake up sometime later shaking, perhaps trying to rid myself of the sleep paralysis.",0,1,0,1,0
"As I walked in the door she came around the corner, squealing with delight and ran into my arms!",1,0,0,0,1
It felt so real that I actually woke up.,0,1,0,0,1
My heart is aching today.,0,1,0,1,0
"Lots of lies, deceit, and manipulation.",0,1,1,1,0
"But, it fits my head.",1,0,0,0,0
"In my head I was thinking, Great first impression.",0,0,0,1,0
She left the room and went downstairs.,0,0,0,0,0
I was house-sitting for my grandparents.,0,0,0,0,0
The grip on my wrist tightened and my arm throbbed from the pressure.,0,1,1,0,0
It's the closest thing I've experienced that I can say was nearly unexplainable.,0,1,0,0,1
Then it began to snow... hard.,0,1,0,0,1
"The second time I saw her, she told me she was a registered sex offender.",0,1,1,1,1
"I trust this man even less than the woman, but I can't put my finger on it.",0,1,0,0,0
It was hung at a very strange angle.,0,1,0,0,1
The object was shaped funny and broken at an odd fracture.,0,1,0,0,1
"The anesthesiologist put an oxygen mask over my face, told me it wasn't the good stuff yet, then I woke up to the room flipping around.",0,1,0,0,1
"I put em in a bowl anyway, brushed my teeth, chugged a smoothy and went to work.",0,0,0,0,0
"I was able to take a bath, which felt good while I was in it and now I feel horrible again, and I brushed my teeth, and washed my hair, so give me some kudos.",1,0,0,1,0
and my hair was straight and nice already so i pull a sweater over my head and jump into some jeans run to the bathroom brush my teeth while combing my hair with my fingers grab my purse and im out the door with sunglasses on cuz i got no makeup on... so i get to the bus stop and realize... I forgot to put out the bottles and a check for the waterman who comes at 9 AM!,0,1,0,0,0
It was so fucking weird.,0,1,0,0,1
And I dongak my head to see who was in front of me.,0,0,0,0,0
Though you can guess that I already have that scene in my head.,0,0,0,0,0
I also brought my bike to the beach and held it over my head standing in the ocean.,0,0,0,0,0
P. if you're reading this...FUCK YOU.,0,0,1,0,0
We were going to blow that record away.,1,0,0,0,0
My finger is an asshole.,0,0,1,0,0
"He breathed on my face, nuzzled my hair with his nose and licked the top of my head.",1,0,0,0,0
"I imagine myself now, lying on the bed with that skipping rope tied around my neck.",0,1,0,1,0
I forgot that my mom needs to be eased into things just long enough to run my mouth off and cause an argument that was way too long.,0,0,1,0,0
"When she decided it was time to go back to my stall, I didn't want to leave and I pretended I didn't know she was asking me to pick up my head.",0,1,0,1,0
"And without even stopping to think about it, I tuck one of those boxes under my arm and go back to the living room.",1,0,0,0,0
Grandmother touches my hand.,1,0,0,0,0
I can go pee here but that's all and then no water to wash my hands.,0,1,0,0,0
I didn't look out of my hands.,0,1,0,0,0
"I thought that was a pretty good idea ( by this point, my feet hurt a LOT from all the walking and standing around ) but I didn't want to pay to see a movie.",0,1,0,0,0
He never was coming.,0,1,1,1,0
i was walking around cursing the day in my head.,0,1,1,1,0
My brain's dead weight I'm tryin to get my head straight but I can't figure out which Cheerleader i wan na impregnate.,0,1,0,1,0
I ate a pizza.,1,0,0,0,0
"I looked everywhere for those 5 cards, 2 ended up between the couch cushions, one underneath a cat tent, one behind the TV, and one in a different room completely, in between the bed cushions.",0,0,0,0,1
i've got the tug happening in my chest.,0,1,0,0,0
I've never gone back.,0,1,0,1,0
"I could still feel glass showering down and now the cut on my head was bleeding pretty badly, I could taste the blood as it ran down my face and mixed with my sweat and hit my lips.",0,1,0,1,0
"Crazy.Anyway, my feet & knees still hurt this morning.",0,1,0,0,0
"Stuck in this place, With the world rushing by, Tears stream down my face, As I stand here, waiting to die.",0,1,0,1,0
The top of the mattress comes up a little above my waist!,1,0,0,0,0
"We stayed in a really lovely hotel-I had two sinks in my bathrooms and white dressing gowns and clippers, any hotel which provides dressing gowns is a good hotel in my eyes.",1,0,0,0,0
"And here in Edinburgh, through this journey of mine, it has been right at my side, in my hand.",1,0,0,0,0
I close my eyes.,0,1,0,0,0
All the changes get thrown out of the window as I attempt to keep my head above water during this 4-day work week before the July 4th weekend.,0,1,0,0,0
One time she showed up to my door wearing a long coat and nothing but stockings and heels underneath.,0,1,0,0,1
My mum says that when she looked in the mirror she saw a pair of glowing yellow eyes.,0,1,0,0,1
"I stopped moving, bent down with my palm out, and let the squirrel jump up on my arm and onto my shoulder.",1,0,0,0,0
I remember swinging on the swings one day when I was in elementary school.,1,0,0,0,0
Just fresh powder underneath a pine grove.,1,0,0,0,0
"When I was 10, we had to paint birds for art, I was pretty good at art but a girl copied my exact one, even though we had to do different ones and I was not pleased.",0,0,1,0,1
Apparently my leg had fallen asleep and I didn't know it.,0,1,0,0,0
"Once we got them all back into the room, one little girl ( the youngest of this group ) roughly pushed a little boy who was standing near me ( I was sitting with my legs blocking the doorway ) into the door jamb in her attempt to get out.",0,1,0,0,1
"She was rude to our photographer, she was rude to a few guests, and to us.",0,0,1,0,0
It was a tempting trap and my greed forced me to fall for it and I burnt my hands there.,0,1,1,0,0
"After that it went downhill with me feeling like I was going to throw up, my throat hurting like hell and my head punding.",0,1,0,1,0
"I would be about 10 maybe, anyway i was out with my mom , dad and sister.",1,0,0,0,0
""" The other boy clarified, ""Sorry about him.",0,1,0,0,0
"I finally managed to sit up on my hands and knees, and glaring up at her.",0,0,1,0,0
Murder is the better word.,0,1,1,1,1
A very similar story happened to my grandmother.,0,0,0,0,1
The sun hung high in the deep blue sky as a slight ocean breeze ticked my face.,1,0,0,0,0
Before I knew it I was on my hands and knees and someone close to me let out a terrible grunt at the same time.,0,1,0,0,0
He pulls out a switchblade and cuts the side of my mouth.,0,1,1,1,0
Well I have the bright idea that I need to stop being like this and I end up alone on the elevator with this girl.,1,1,0,1,1
My head pounded and my lips were chalky; that was a good sign.,0,1,0,0,0
"That was a 16 hour day, 19 for most people, except I pulled a muscle in my back and couldn't move without being in excruciating pain.",0,1,0,1,0
My index fingernail is positively burnt off on the top and my finger is singeing from pain and it's all because I wanted to use a candle to light another candle why oh why am I so brainless?,0,1,1,1,0
"probably towed by now"".",0,1,0,0,0
"Oh well, Bride's Day, Bride's Way!",1,0,0,0,0
That one was probably the weirdest.,0,0,0,0,1
"Now, I just sit there and nod my head, as I listen to the excuses people use to not make positive changes in their life.",0,0,0,0,0
"Despite my anxiety, You were there with me, Diligently working in my heart, Stripping me of all of my pretense, Scourging me of all of my arrogance, Revealing each of my self-serving ways, Which have made my life a wasteland.",1,1,0,1,0
Then Bodybag was on my case and was ordering a cell search and people were shoving the `` uppers '' into my hands to which I was there trying to hide them in my pockets and such.,0,1,1,0,0
The stench hit me first.,0,1,0,0,1
I keep trying to keep my head up and not think about it.,0,1,0,1,0
My face hurt from laughing so much!,1,0,0,0,0
Poor little guy was completely *covered* in fleas.,0,1,0,1,0
Tried to talk to my cousin to see whether this was really a possesion or something else.,0,1,0,0,1
I have no explanation.,0,1,0,0,1
Some work had been done on the driveway.,0,0,0,0,0
"I was angry at how she made me feel, I was angry that my eyes were all puffy and bloodshot when I woke up, I was angry that I had a cold shower.",0,0,1,0,0
"My throat felt like I was choking down hot, spiked coals.",0,1,0,1,0
"I moved my arms, stretching the muscles, watching ribbons of flesh dance around skin and bone.",1,0,0,0,0
I remember sitting on the curb putting it to my ear and listening to the music.,1,0,0,0,0
"the new apples of my eye, as promised.",1,0,0,0,0
"Sad, and creepy huh?",0,1,0,1,1
He was very weird.,0,1,0,0,1
"It was a weird feeling, building up in my chest and my head and then it all switched and I couldn't turn it back!Seriously, try it!First of all, I started off right-brained.",0,1,0,0,1
... as it engulfs every fiber of muscle in my legs!!!,0,1,0,0,0
Got tired roaming' and bumming' around,0,0,0,1,0
"Tears spilled onto my cheeks, and I let myself rest in the pain.",0,1,0,1,0
I turned my head to oncoming headlights.,0,1,0,0,0
"He bought the first beer, and before it was even gone I had a new full one in my hand!",1,0,0,0,0
"v-neck shirt, I moved slowly throughout the house, doing my usual morning duties ( diaper changes, breakfast, coffee ), quite lethargically, occasionally brushing a strand of ( dirty ) hair away from my eyes with my hand.",0,0,0,1,0
"i hope whatever i did do today, the two paper 2s adn the reading of the ntoes adn the definitaions i recited, stick in my head and i do nt forget anything: ( sigh.",0,1,0,1,0
Hit it off really well.,1,0,0,0,0
He was so very sad.,0,0,0,1,0
I've backed off hills while my foot healed so I expected some soreness.,0,1,0,0,0
My legs and face were also covered.,0,0,0,0,0
"My eyebrows raise as I smile, ` Ready for the second shot?",1,0,0,0,0
"She had a fish tank with two fish, a bottom feeder and an angel fish.",1,0,0,0,0
"Stretching until my toes were caught by the sheets and my fingertips brushed the headboard, I opened my eyes.",1,0,0,0,0
I bent my knee inward.,0,0,0,0,0
"But my natural color, on the underside of my forearms for example, is `` dead fishbelly white.",0,0,0,0,0
"One day, one of the Nazi soldiers went missing.",0,1,0,1,1
"my grandma, my mom, my grandaunt, my aunt, my sister I CRIED and WEPT in my sleep... I just shook and sobbed and sniffled... then I woke up and my eyes were wet.",0,1,0,1,0
My foot was tingling for sometime afterwards but the pain was mostly gone and there was no more grinding sensation.,0,1,0,0,0
"When we got up this morning, I could hardly move, and now EVERYTHING from the base of my skull to my waist hurts and my right arm isn't quite right.",0,1,0,1,0
""" The black family behind me looked mortified.",0,1,0,1,1
She was unhappily employed stripping at the time.,0,1,1,1,0
I was writing away.,1,0,0,0,0
for the wedding AND rehearsal dinner.,0,0,0,0,0
Never saw him again.,0,0,0,1,0
I was at a large rock festival.,1,0,0,0,0
"I abruptly ""woke up"" again out of sleep-paralysis in a state of crazy shock.",0,1,0,0,1
I can never forget it.,0,1,0,1,0
"The wind was in my face, and my nose was cold.",0,1,0,0,0
"Man, I was wrong.",0,0,0,1,1
"But I was happy and pretty tickled that I was able to get out and go fight or hunt / scrap for materials that I do nt have to pay for, as well as just get out in the open air.The downside was... I really twisted my ankle and its slowing me down considerably.",1,0,0,1,0
"Anyway, so I read the cave thing and went to bed pretty creeped out.",0,1,0,0,1
"Too many calories, my brain just couldn't deal.",0,1,0,1,0
The spring sun was just rising and his car was already ripping down the highway.,1,1,0,0,1
I filed a complaint.,0,0,1,0,0
We are earths last hope against extinction.,0,1,0,1,1
I've been thinking about it more and can't get my head around it.,0,1,0,0,0
My wife is non-religious.,0,0,0,0,0
i had already decided that i was completely fine other than my ankle.,0,1,0,1,0
For a few months i have always been thinking about getting my tongue pierced.,1,1,0,0,0
The treatment for my original complaint consisted of some chiropractic manipulation of my hip and pressure onto certain nerves ( which was painful but better afterwards ) and then a marvellous half an hour of lying still with aromatic herbs massaged into my lower back and an assortment of needles inserted at strategic points.,1,0,0,0,0
""" The cop tells him to have a nice day and walks away.",1,0,1,0,1
No kids were hurt.,1,0,0,0,0
"Back to my dear old pals at the walk-in clinic to get a prescription for better eyedrops.Oh, and my throat hurts like hell again.",0,1,0,1,0
The second entry of today: / my brain hurt for answering 30 math question in one day.,0,1,0,0,0
Then proceeded to duck and run past him into the female restroom.,0,1,0,0,1
so I'm stir my heart for Europe travel.,1,0,0,0,0
"I want to learn about you, communicate with you.",1,0,0,0,0
You might actually say they're almost angelic....,1,0,0,0,1
Sure enough - same car.,0,0,0,0,1
Not creepy but ghostly.,0,1,0,0,1
"When my back hit the far wall, and the shovel against the wall fell on the dirt, I screamed.",0,1,0,1,1
""" staring dead at my ex.",0,1,1,1,0
"Then suddenly, she heard a strange thump; but looking around saw nothing.",0,1,0,0,1
I have to go deep in myself not to walk down the familiar streets in my head.,0,1,0,1,0
"It was a branch line to a gravel quarry, so the three or four daily trains moved slowly.",0,0,0,0,0
I'd trust the terrorist with my life.,0,1,0,0,1
I noticed his eyes looked weird...scary.,0,1,0,0,1
"Between moving appliances yesterday at work, and this morning where I tensed enough to tweak my back, I'm a bit sore.Now Paka has been staring at me wide-eyed and giving her whining-style meow.",0,0,0,1,0
Not too bad but never really clicked.,1,0,0,1,0
Never trust a fart.,1,1,0,0,0
but bigger and about six foot of the floor.,0,1,0,0,1
"I always had my nose in a book when I was younger, and when I moved up here I lost interest.",0,0,0,1,0
"Then while it was still on my heart, I opened it into a V with my index and middle finger.",1,0,0,0,0
Telling me I'm going to hell.,0,1,1,1,0
I go in and sit down at my usual seat.,0,0,0,0,0
The afterimage lit up green and orange against my eyelids.,0,0,0,0,1
It seemed so arbitrary.,0,1,0,1,1
He was so close.,0,1,0,1,1
"That took about a week and a half, then I had surgery to put eight plates in my face to rebuild it.",0,1,0,1,0
We grew pretty close.,1,0,0,0,0
I told him three things:,0,0,0,0,0
All of the sudden I hear both of them scream bloody murder.,0,1,0,0,1
"I started out the run, and before too long something caught my eye in the snow.",0,0,0,0,1
"Now, I didn't feel like spending money.",0,1,0,1,0
"So, I was ten years old at the time.",0,0,0,0,0
"pound hand weights, start with my elbows on the ground then all the way up and on the way down do the same down 2 up 1, breaking the trip down into 7 sections.",1,0,0,0,0
"Needless to say, the plant died from her residual evil.",0,0,1,0,1
I brought my head up to the edge of the grass and peered towards the road.,0,0,0,0,0
melancholy I got up for work this morning and turned on the news like usual but i heard a story that broke my heart and brought me to tears.,0,1,0,1,0
:P Look at my face it's super chubby.,1,0,0,0,0
As he approached the edge of it he took to prep hops.,0,1,0,0,1
A knock on the door and my heart litarely stopped for a good three seconds.,0,1,0,0,1
seriously... my head is just not in the game.,0,1,0,1,0
The day was hot and still; the air lay close against my face.,0,0,0,0,0
I was scared shitless.,0,1,0,0,1
"Shivering caused me to tense up, which caused my hips to keep cramping in charlie horse fashion.",0,1,0,1,0
First day of school.,1,1,0,0,0
But it was good; it kept me on my feet for a long while.Knee?,1,0,0,0,0
I don't stop.,0,1,0,0,0
A stranger is running alone in the park.,0,1,0,0,0
"I sweated my balls off, tore up my muscles and got new bruises ( right after the old ones healed ), but the building is lovely and cool and I have an amazing view of the ocean from the upper floors.",1,1,0,0,0
"Well she's not gon na last the whole song like that, so since I'm behind her and the audience can't see below my torso pretty much, I use my hand to push down on the lid and support her weight.",1,0,0,0,0
I keep thinking about how almost a year ago exactly I found my PCP and had 2 problems-my shoulder and my back.,0,1,0,1,0
I feel it slithering down my skin like a anaconda snake.,0,1,0,0,1
"I have incredibly pale skin, poor circulation in my lips, and blonde eyebrows and eyelashes.",0,0,0,0,0
"Staring down at the device, I felt this cold chill start at the base of my neck and spread throughout my body.",0,1,0,0,1
"You see, I was still on my journey to healing a bit of a `` broken heart '' so practically my heart was not in a bad shape then.",0,0,0,1,0
between my legs.,0,0,0,0,0
"I ask her to tell me hers first, and she starts telling me how she dreamed the Sears Tower was falling down...",0,1,0,0,1
"Once, while lying in bed falling asleep, I felt that the zombie apocalypse was beginning at that very moment.",0,1,0,0,1
"As they walked up to the cross walk, they were horsing around.",1,0,0,0,0
Let's hit it.,1,0,0,0,0
"At this point I am starting to have an anxiety attack, but I keep listening.",0,1,0,0,0
"She said she agree with me but didn't know how to leave... To that, I shrugged my shoulders, shit I know how, pack your shit and leave... I mean, you know?",0,0,1,0,0
Maybe they saw the look of ecstasy on my face as I sped up and slowed down with twiddling precision.,1,0,0,0,0
"Shitty situation, dont protect yourself with guns unless shots have already been fired.",0,1,1,0,0
He was admiring the tattoo on my forearm.,0,0,0,0,0
"I yawned, blinking my eyes rapidly as I muttered, `` Sorry, Lee. ''",0,0,0,0,0
"So, for the second time in less than twenty minutes, Ive had my dream crushed and my blood pressure boiling.",0,1,1,1,0
"The hand returned, a welcoming gesture, an unwelcome sensation.",0,1,1,1,1
Which means I was not picking up my feet!,0,0,0,0,0
"determined well, i've been going to the gym a little over three weeks now, and i've lost eight pounds, and roughly twelve inches total-about three from my waist, two and a half from my hips, a half inch from each thigh, and four total from my... um... upper torso area... anyway, it feels awesome.",1,0,0,0,0
It disconnected and teetered away from us.,0,1,0,1,1
Unfortunately my mum decided to clear out his old room and she found them.,0,1,0,1,1
I stop and wait.,0,1,0,0,0
