text,Joy,Fear,Anger,Sadness,Surprise
"Every movement of the body below my waist caused pain, in such a way that I could anticipate it and, with a bit of understanding, even cope.",0,1,0,1,0
The last week I've gone to bed at 7 every morning with house music blasting in my ear and have woken up with only an appetite for more.,1,0,0,0,0
My nose was still clogged and breathing out of just one nostril has become a work of art for me but I decided I was up for a loop through the neighborhood.,0,1,0,1,0
Just helping a kid.,1,0,0,0,0
"""Mom"" never disciplined them.",0,1,1,0,0
I couldn't believe my eyes.,0,0,0,0,1
"I've tried sewing pants and a skirt for Vivian but both turned out too short, so I'm sending them to Baby G. I burned my fingers four times in two days.",0,1,0,0,0
"My long brown hair caressed my face, small curls wrapping around my ear softly.",1,0,0,0,0
Charlie was so crazy!,1,0,0,0,1
"this is why i get up every day, lace up my chucks and keep a smile on my face through all sorts of patron issues.",1,0,0,0,0
"There was an awkward, frozen moment as we all acknowledged each other and as my brain scrambled to make sense of this ""hallucination"".",0,1,0,0,1
I was incredibly nervous; I had butterflies in my stomach and my legs felt weak.,0,1,0,0,0
"When I was raised, my parents had a strict religious work ethic.",0,0,0,1,0
"I was petrified, he looked really calm.",0,1,0,0,1
Most I've met off Craigslist.,0,1,0,0,1
At this point my cousin notices that his house is decorated entirely with circus clowns.,0,1,0,0,1
"What is truly remarkable about this brotherhood of my moms uncles, is that they all radiate the same aura.",1,0,0,0,0
"I handed him the Ipod he just moved on, I felt the blood dripping down my nose.",0,1,0,1,0
"My eyes constantly throbbed from being so dry, even though there always seemed to be tears to cry at night.",0,1,0,1,0
""" and told me ""Spook"" was racist.",0,1,1,0,1
At one point it even came up to my foot to nibble on the grass near my toes.,1,0,0,0,0
I've got it all planned up in my head,1,0,0,0,0
"I don't know how, but as soon as we started, I got 3 numbers in a row completely correct.",1,0,0,0,1
I thought she was stuck-up and nerdy.,0,0,1,0,0
I fell asleep with visions of 5 grand dancing in my head.,1,0,0,0,0
"I could feel it on my back; cold, wet and aged.",0,1,0,1,0
"Then I decided to try and get up to go to the restroom, but I couldn't move!",0,1,0,0,1
Yea I'm with you there man.,1,0,0,0,0
This was the worse night of my life.,0,1,0,1,0
"As I lay upon the table with my eyes closed awaiting a peaceful treatment, she began to talk... OH NO!",0,1,0,0,1
It was mutually beneficial.,1,0,0,0,0
House almost burned down the weekend they were out of town.,0,1,0,1,1
"I have lots of acquaintances, and a few people that I hang out with on a regular basis, but I still haven't found a friend that I actually like a whole lot, because after maybe a month or four, everyone that I get semi-close to starts to get on my nerves.",0,1,1,0,0
Im wasting my time doing nothing with my sister's E5700 hanging on my neck.,0,1,0,0,0
I pushed those thoughts out of my head and told myself I was being paranoid.,0,1,0,0,0
That may be unverifiable.,0,1,0,0,0
"We didn't know what to do: the harder we pulled, the harder the trap stuck to my fingers.",0,1,0,0,0
My aunt and I are kind of doing the remedial training together and I can't wait to get on his back.,0,0,0,0,0
"By the time I got done, my back was killing me ( but then it has been a problem since the last week of December ) and I felt pretty ill, but I got it done.",0,0,0,1,0
""" Those little blonde kids!",0,0,0,0,1
I walked out kamiyacho station with a big question mark in my head.,0,1,0,0,1
he got pretty fucking scared and started sprinting away from me.,0,1,0,0,1
"He was then hit by congestive heart failure, fell into a coma, and passed away.",0,1,0,1,1
"""I LOVE YOU, I LOVE YOU, I LOVE YOU...""",1,0,0,0,0
"The next day I turned it back on and all was fine, and when I checked the sample music and my own, there was nothing that sounded even remotely similar.",1,0,0,0,1
My friend set me up on a blind date with this woman.,1,1,0,0,1
"I nodded, pulling my arms across my chest, hoping that the rain obscured the tears that ran from my eyes.",0,1,0,1,0
"I mentally refused to go there, shaking my head violently in that refusal.",0,1,1,0,0
"and sometimes an elbow to your side makes you realize that you better get moving too!time waits for no man, tom waites makes my spine tremble, and thyme makes a good spice.",0,1,0,0,0
"I close my mouth in a fine line, remembering one line after another.",0,1,0,1,0
"My eyes followed, noting that there was just the two of us.",0,0,0,0,0
7) Went to dinner with a woman in an open relationship.,1,1,0,0,0
"My left clav essentially blew up, but it didn't stop there.",0,1,0,0,1
"I pull the trigger, feel the recoil in my hand along with the professionally, almost muted sound and watch him shudder and then go limp against me.",0,1,1,1,0
good lord... where to start well i was getting ready to leave for rocky... and my mom saw me and pulled me aside to `` tirm '' my hair... what was once close to my shoulders is no more... now i kinda look like man at arms.,0,0,0,0,0
My brain's been cooking up too many ideas that I can't even write out for future references.,0,1,0,0,0
"The priest must have taken pity on me because of the rain, because my hands were otherwise engaged, and apparently because he thought I looked smokin ' hot.",1,0,0,0,0
It started out like a small ache but as the day progressed it turned into this sharp jabbing pain in my ear.,0,1,0,0,0
"I'm that forgotten tear That forgot to fall Yet lingers on my cheek Brush it away And it's still there Lick it up, And feel it burn your throat, Stripping it red raw.",0,1,0,1,0
Best/worst physics class of my life.,1,1,0,1,1
"Maybe my nose is often runny, but I can smell danger well enough.",0,1,0,0,0
It was a this point I caught something out of the corner of my eye.,0,0,0,0,1
There was a red burn mark on my chin for a couple of weeks.,0,0,0,1,0
"I turn around, hoping my back hid part of my drawing and look down at the paper in front of Ryutaro, my hand only inches away from his and start to explain the directions a little clearer to him.",0,0,0,0,0
I caught a co-worker stealing my prescription migraine medicine.,0,1,1,0,1
"I just happened to hold the stresses and frustrations ( that most kids probably have with school, parents, new friends ) in my eyes.",0,1,0,1,0
"Ok, I'll tell you something which is both very creepy and very, very real.",0,1,0,0,1
"And when I say online banking, it was not internet banking.",0,0,0,0,1
There's a couple dead rats and the basement had a lot of old broken furniture.,0,1,0,1,0
"Sometimes my eyes feel so transparent, so rubbing them helps my eye lids feel real.",0,1,0,0,0
I run to grab my friend only to see him dancing with another asian girl.,0,0,1,1,1
"So, my father owns a insurance agency.",0,0,0,0,0
"`` Well then, by all means, curl my toes. ''",0,0,0,0,0
"Somehow, with visions of doll masks and pocket 6s dancing my head, I still managed to fall asleep.",0,1,0,0,1
"On the second block, it hit me.",0,1,0,0,1
I could feel my heart breaking into millions of pieces.,0,0,0,1,0
I get real scared now.,0,1,0,0,0
I'm lost in my own little world.,0,1,0,1,0
Heart racing as well.,0,1,0,0,1
She never went through general anesthesia again.,0,1,0,1,0
"It started out slow, like we'd fight once a month over stupid little things and sometimes big things.",0,1,1,1,0
"I opened the do0r to his bedro0m and saw... Awwww... His whole ro0m was filled with red, pink and white ballo0ns...:] thats my babe tryin to walk through all of the ballo0ns... and i had to sort through all the ballo0ns and lo0k for two ballo0ns with surprises in them Then he gave me roses he made out of M & ms:], you know what i mean ( ( sorry my thumbs retarded ) )",1,1,0,0,1
I close my eyes determined to find light every ray that shines through is blotted with the darkest of dark I hear a constant drumming.,0,1,0,1,0
"Just as the priest asks if there is any objections, a huge booming thunder rolls out, sounding like a cannon in the church.",0,1,0,0,1
"There was nothing else of mine in her belongings, and I stood up and dusted my hands off.",1,0,0,0,0
"My eyes drank in the wild landscapes, like I'd discovered a new land.",1,0,0,0,0
I was horribly mistaken.,0,1,0,1,1
"I shook my head, put the car in gear, and had to force myself to drive away.",0,1,0,1,0
"It was dark but I could see my door was slightly open, and on the other side was from what I could tell a giant eye.",0,1,0,0,1
"I met my best female friend on omegle, she lives 3000 miles away from me and we have never met.",1,1,0,0,1
Any potential bride is warned:  The groomsmen gifts will be swords.,0,1,0,0,1
JUST STOP IT ALREADY!,0,1,1,0,0
It cut through all the fear and anger in my brain.,0,1,1,0,0
She finally decided to go to the doctor.,1,1,0,0,0
Then he drove away.,0,0,0,0,0
"I don't mind conditioning, but with my hip?",0,1,0,0,0
"Jeff got in the tub with me at some point and was also rubbing my back and such, as most of my labor was in my lower back.",0,1,0,1,0
"It was probably about 21:00, either way it had already gone very dark (was possibly winter time).",0,1,0,0,0
"Thats right,  this iPhone had been lying on train tracks, in broad daylight, for 6 months, and it still worked flawlessly.",1,0,0,0,1
"( my foot, i think, had stopped bleeding for the most part by now. )",0,1,0,0,0
My mom wanted us just to spite my dad.,0,1,1,1,0
"I was okay, though it was hot when it landed at on my arm.",0,0,0,0,0
Fucking freaked me out...never found out where the hell that coat fell from,0,1,1,0,1
The storm gets worse.,0,1,0,0,0
You've clearly been to hell and back.,0,1,0,1,0
"That night, around 2am, she woke up to the sound of a woman screaming.",0,1,0,1,1
& # x 26; nbsp; The rocks were so slippery and I kept bending my ankle between rocks.,0,1,0,0,0
Then I got to a parking lot and got a funny idea in my head to toss it at a car.,1,0,0,0,0
They ended up suspending girls as well.,0,0,1,0,0
Now this was even more precious to my heart.,1,0,0,0,0
"like seriously, alot can not understand and im slow at registering words in my brain during that time, so yeah.",0,1,0,1,0
"i tried to get out of bed and as i did, i immediately fell on the floor, unable to get my legs underneath me.",0,1,0,1,1
"They fit the intended recipient, but are entirely too big for my feet.",0,0,0,1,0
My feet started taking a heavy beating and the sun was burning my whole body.,0,1,0,1,0
"I did as much time as I could on my feet for closing gate, but had to sit for stretch before cannon.",0,1,0,0,0
My brother noticed my face was really red.,0,0,0,0,0
"as usual, i feel like im carrying too much burdens in my heart.",0,1,0,1,0
Anyway we've been married almost nine years.,1,0,0,0,0
Douse them in infanticide.,0,1,1,1,0
"The Spot on my ear was bot good, but not alarming.",0,0,0,0,0
"They jumped from the couch and aimed for all of the areas with sensitive skin-the underside of my arm, along my belt line, the insides of my thighs.",0,1,0,0,0
It freaked my uncle right the hell out.,0,1,0,0,1
Mildly inconvenient but so weird.,1,1,0,0,1
We've been friends ever since then.,1,0,0,0,0
What happened to my heart when it broke into pieces?,0,0,0,1,0
"I must have had a strange look on my face because my mother said, `` What's wrong? ''",0,1,1,1,0
"Back in 2006 when I was in high school I took Earth Sciences, and in the spring I was on my teacher's computer when I came across a photo of me giving the thumbs up.",1,0,0,0,1
"However, I get sick to my stomach when I think about the fact that I have been sleeping with my brother for so long.",0,1,0,0,0
I stopped a couple times to stretch out my calves and quads.,0,0,0,0,0
He didn't swerve.,0,1,0,0,0
"Fox arose from his limp slumber, And drank cold water From my eyes.",0,0,0,1,0
Alarms rang in my head.,0,1,0,0,0
"This will get lost but whatever, Nobody fucking believes me.",0,1,1,1,0
I am still getting used to getting my feet in and out of the clips on the spd pedals.,0,1,0,0,0
I try to slow down things.,0,1,0,0,0
""" It was super creepy.",0,1,0,0,1
He was my dad.,0,0,0,1,0
The silent one looked increasingly nervous.,0,1,0,0,0
"People are starting to chant ""Fight, fight fight"" while some say ""Bro, it ain't worth it"".",0,1,1,0,1
"But I am exhausted-my eyes feel like they are about to pop out of my head-I need some soothing music and images to help my mediate, even for a few minutes, just take me away $ # 365 yoga Monday's Musical Meditation: 0 minutes ago early night-first day of work after mat.",0,1,0,1,0
"The manager was at the till beside the front door, and the rest of us were mopping upstairs, cleaning tables and giving the staff toilet and stock room the once over.",0,0,0,0,0
It was hairless and covered in gray skin.,0,1,0,0,1
Second story (equally creepy):,0,1,0,0,1
I was still naked.,0,1,0,0,1
I can't bend or twist my head and no lifting anything over 10 pounds.,0,1,0,1,0
This is where the story gets CREEPY.,0,1,0,0,1
So I got my hand on the Healthy wear powder foundation in creamy beige for $ 3.45.,1,0,0,0,0
"Her hair was greasy, stringy, and falling out.",0,1,0,1,0
"I freaked out and, eyes still closed, went back to bed.",0,1,0,0,1
This hasnt changed since I was very young.,0,0,0,1,1
Not exactly an objection but very close.,0,1,1,0,1
"We get to the porch and my dog starts *growling*, like a big boy growl, like shits going down growl.",0,1,0,0,1
"A close friend set me up on a double date with her, her boyfriend, and the boyfriend's friend on Valentine's Day.",1,1,0,0,1
Thankfully I never went through with it.,1,1,0,0,0
"No water damage, sun damage, tears, anything.",0,0,0,0,1
There's my stoner floor mate with a fucking stun gun.,0,1,1,0,1
I naively walked up and stuck my head in the driver's window hole.,0,1,0,0,1
And you'll have just married psycho ex.,0,1,1,0,0
"My mother announced our names into the intercom; I folded my hands prayer-like: calm down, calm down, calm down.",0,1,0,0,0
"They strapped some thing ( yes, that's a technical term ) around my belly that monitors the baby's heartbeat and contractions ( which I was unaware of at the time, but found out about later. )",0,1,0,0,0
"I ran my hand through my hair, trying to clear my head.",0,1,0,0,0
I washed it out and for about 3 days my eye stayed bloodshot.,0,1,0,1,0
"So the money is ""taken"" from the employees.",0,0,1,0,0
That thing was there.,0,1,0,0,1
We haven't talked about it since.,0,0,0,1,0
""" I radioed to Infinity.",0,0,0,0,0
These dogs jump on me and scratch my legs and when I get out of the car they try to jump inside.,0,1,1,0,0
I closed my eyes and tried my best to ignore it and i eventually ended up falling asleep.,0,1,0,0,0
The black panther is here!.,0,1,0,0,1
"Just going for a walk once, I saw a car turn down a road that was a dead end.",0,0,0,0,1
"It was a dark, awful feeling.",0,1,0,1,0
"The lady with the suction thing kept getting it stuck on my tongue so it made this weird duck noise, which made me giggle nervously and delay the entire procedure.",1,1,0,0,1
The bus is gone.,0,1,0,1,1
I had worked and my hand's still hurt and all kinds of bullshit lazy Cleo reasons for not going out and having fun when I have time.,0,1,1,1,0
He never took out the garbage.,0,0,1,1,0
"But I was feeling really nervous, and my hands were sweaty.",0,1,0,0,0
I felt a slight heat creep over my cheeks and I giggled lightly coming back to the thought that he was all mine.,1,0,0,0,0
Immediately my throat tightens.,0,1,0,0,0
"I went up on stage and sang my heart out, and afterwards signed up to sing another song with Becca ( alas we ran out of time ), and though I don't know any dance moves, I got a bit of a rythm, so it was all good!",1,0,0,0,0
my lungs and chest have hurt for 6 days straight.,0,1,0,1,0
"My grandma used to do a ""magic trick"" that to this day i can't explain.",1,0,0,0,1
"I stopped, my foot already at a turn in the road that led down to a sunlit valley.",1,0,0,0,0
It leaves both my hands free to be able to type.,1,0,0,0,0
"I suppose I could put a piece of my heart in there, too, since our children are exactly that, aren't they?",0,0,0,0,0
Never saw them again...,0,0,0,1,0
"When I pulled her back in, her hand went to the perfect spot on my chest.",1,0,0,0,0
"So he should be eating the pizza I'm stuffing into my face, like a chipmunk.I understand the impulse these days.",1,0,0,0,0
I hollered but nobody came to see it.,0,1,1,1,1
"My body is bruised, my leg is cut, and my ego is tarnished!",0,1,1,1,0
I go to her pictures and see the image of what was in my head right there in front of me...,1,0,0,0,1
I closed my eyes and more tears glided down my cheeks.,0,0,0,1,0
"We could have been part of organized crime, but my grandpa (who died before I was born) didn't want any part of it and decided to live an honest life.",1,0,0,1,1
Needless to say I never called him back.,0,0,1,0,0
And that concludes this post of random news from my neck of the woods!,0,0,0,0,0
"Because neither of us could drive, he also had to go to dinner with the other two beforehand and meet up with me at the show.",0,1,0,0,0
"Amanda and I carried the washer up with no problems but as we sat it down in the street, my back gave out.",0,1,0,1,0
"I'm thinking of leaving earlier, maybe this week, maybe next week... My heads a mess right now.",0,1,0,1,0
"But when i see, what i'm missing I just can't take it SO here i sit miserably all alone... Its your eyes and your smile that puts the beat in my heart And to know I can't have this just tears me apart....",0,1,0,1,0
Pain-I have injured my knee somehow.,0,1,0,1,0
It was quite old.,0,0,0,0,1
"My heart, it was finally home.",1,0,0,0,0
"Exactly a year ago i remember sitting at home on my laptop, talking to adam and whoever else, it wasnt quit as cold as it has been lately and i remember having a huge smile on my face.",1,0,0,1,0
I was less sad about missing my birthday though and more sad about missing her.,0,0,0,1,0
it was pure terror.,0,1,0,0,0
more funny than creepy being on this side of the story:,1,1,0,0,1
Luckily for me I have to use the restroom every 15 minutes so midway through our appointment I was already trying to cross my legs again.,0,1,0,0,0
"But well need large plastic bags, I dont know where to get those.",0,1,0,0,0
we got stuck on pandemonium lol it was so funny.I hurt my foot somehow lol figures now that I have no insuarance and I'm waiting to hear back from mass health.,1,1,1,1,0
This was on both sides of my chest.,0,1,0,0,0
Met a lot of random canadians that night.,1,0,0,0,1
Apparently the aftermath of the clogged toilet was pretty gruesome.,0,1,0,0,1
"There were dozens of us, crying, screaming, or in shock.",0,1,0,1,1
i think ) into my skin to make the wound bigger then squeezed everything out.,0,1,0,1,0
Seemingly because the bartenders were very heavy handed.,0,0,1,0,0
"""How the hell did you get her down?!",0,1,1,0,1
"See, I saw the movie trailer first, and it looked interesting, ( and, yes, I do have a bit of a crush on Pattinson ) and in my head I made up my own story.",1,0,0,0,0
"It never freaked me out, because it happened enough as i was small and I got used to it.",0,1,0,0,0
I was like wtf.,0,0,1,0,1
"I never felt very ""spiritual"".",0,0,0,1,0
It was just garbled.,0,1,0,0,1
This was right before sunset when we got in bed and I instantly fell asleep.,1,0,0,0,0
I have plenty more.,1,0,0,0,0
my stomach is all out of whack.,0,1,0,0,0
"I found a relatively bugless spot, went through the short version of my routine, pounded my hip with my fist a few dozen times, then got back on the road.",0,0,0,0,0
"Was a routine trip, 11 miles to RWC motoring and into a southerly wind, more wind than we saw during race time and with the sun straight in my eyes most of the way down.",0,1,0,0,0
"I was 7 and woke up early, so I went to the basement to watch cartoons.",1,0,0,0,0
I will never forget that night.,0,1,0,1,1
He changed our last name ever-so-slightly and was never caught.,0,0,0,0,1
Isn't that... Oh I don't know... Against the Bill of Rights?,0,1,1,0,1
"Yes, my belly is getting big.",0,0,0,1,0
The asphalt was so hot it had burned the balls of my feet to the point of blistering from standing on it.,0,1,1,0,0
She ended up going home after that.,0,0,0,1,0
I felt a gun pressed against my forehead and looked up.,0,1,0,0,1
"I jumped out wrapped a towel around me, dried off my hand and face and answered it.",0,0,0,0,0
Then a few days later i told her Jenny wanted me to come to the basement to play with her.,0,1,0,0,1
I liked the Trains better than the Refers.,1,0,0,0,0
my knee's are the only weight left keeping me up to abroad.,0,1,0,1,0
I'm so sorry.,0,0,0,1,0
"I had a difficult time reaching the target HR, even in the lowest gear, but I still got a really nice burn in my legs.",1,0,0,0,0
"Back in the 70s, my mom found a bag in my room.",0,1,0,0,1
"My brother was tapping me on my shoulder, and I was like `` What? ''",0,0,0,0,0
"Arms back, chin down.",0,1,0,0,0
The barn is full of corpses.,0,1,0,1,1
"Our G-mail accounts are one letter apart, mine having an ""L"" in the middle for my middle initial.",1,0,0,0,1
"And again, I kinda woke up to another dream.",1,1,0,0,1
"Its most famous picture is Picasso's Guernica, inspired by the civil war Spain was enduring.It has a selection of amazing Surrealist works by Dali and a number by Joan Miro, some of which were laughably simplistic to my eyes and a selection of art from the 1940s to present in its permanent collection.For its temporary exhibitions it had one on digital art and new media.My favourite works were the series of ` mirrors ' by Daniel Rozin from Israel.",1,0,0,0,0
"I'm still feeling woozy, it's hard to type because my muscles are not cooperating with me.",0,1,0,0,0
"A old, gray lady.",0,0,0,1,0
"' ( today ) So the story of my grandparents ' illness continues... I'm scorching my tongue on coffee, and my head on looking at the screen.",0,1,0,1,0
I'm finally going to be going back to work... haven't been able to work because of my knee.,1,1,0,1,0
Luckily the security guard is cool with me and let me stay.,1,0,0,0,0
"My face is cold, and my hands are guilty.",0,1,0,1,0
"That evening, they put me down to sleep in the cot, and went about their evening routine.",0,0,0,0,0
"I then started to cry again, with a doll in my arms.",0,0,0,1,0
"I filled it out and tried to stay calm, but my legs were still shaking!",0,1,0,0,0
Either way I was scared for my life that day...,0,1,0,0,0
""" She awoke from this odd dream and told her mum to wake up her sister.",0,1,0,0,1
I couldn't get loose and ended up pulling so hard that i pulled my tooth completely out.,0,1,0,1,0
"As I turned to walk out of the alley, a pair of brass knuckles crushed into the side of my face.",0,1,1,0,1
One drink down and she was blackout drunk.,0,1,0,1,1
I go to New York City about once a year to visit family.,1,0,0,0,0
"I had to listen closely, to close my eyes, to feel it filling my head.",0,1,0,0,0
mmm... my mouth is watering just thinking about it!,1,0,0,0,0
"Prior to, we got some humongous popsicles which turned my tongue an amazing shade of blue, and we visited the children's A&S display.",1,0,0,0,0
He wrapped his little fingers around mine and my heart melted.,1,0,0,0,0
"A strangely calming breeze crosses my face and shoulders, mysteriously skipping right over my legs.",1,0,0,0,0
I was very scared.,0,1,0,0,0
"*Creepy/unnerving* that is, and just weird.",0,1,0,0,1
He let a raccoon into our house.,0,1,1,0,1
"Then, we issued the first strike.",0,1,1,0,0
I shut my eyes and let the tears take over.,0,0,0,1,0
"I had my hand on the side of my face when I was drawing, and then I moved it and was like ` OH MY GOD I 'M BLEEDING OUT MY EARS AHHHHH!",0,1,0,0,1
Walking through the toilet aisle I decide to let a fart out and make the aisle smell.,1,0,0,0,1
It grew louder and was soon joined by a field of light angling out above my head and over the chasm.,0,0,0,0,1
I had to wear sunglasses to keep the snow out of my eyes-fortunately the brown lenses were ok for the low light.,1,0,0,0,0
See my thumbs.,0,0,0,0,0
I know last time I did this I hurt my back a little but I never learn I'm hard headed I wanted to burn up some more calories.,0,1,0,0,0
Like there was an invisible wall.,0,1,0,0,1
"Vomit lots, and lots.",0,1,0,0,0
"`` I thought that I was biting into something hard in my taco, but it was my TOOTH!",0,1,0,0,1
"I thought I was clear until I felt a hand grab my shoulder, I turned in shock to see an off duty Roman who had been passing, I knew he was a Roman from the ring which every Roman wore, his citizen's ring as they called it.",0,1,0,0,1
My roommate was asleep in his bed.,0,0,0,0,0
*** It was 11:45 pm when my cell phone buzzed in my pocket and my eyes fluttered open.,0,0,0,0,1
"My hand was indeed gone, but new fingers, stubby and underformed, were sprouting from the stub.",0,1,0,1,1
Well Yesterday went to the Hospital to have my brain poked at ( Im guessing some kind of treasure hunt thing looking for it ).,0,1,0,0,1
At times I was actually having difficulty breathing because the water was in my nose.,0,1,0,0,0
Driving around neighborhoods in the middle of the night on very little sleep everything gets to be a bit surreal.,0,1,0,0,1
"It was absolutely delicious and I enjoyed every bite, trying to push guilty thoughts out of my head, although I couldn't stop thinking all afternoon about how many calories must have been in there!",1,1,0,0,0
"Why people remember what they remember, why they forget what they forget For now just introduce her to familiar situations Gently. Shankar said in a hard, warning tone, before adding in sympathy, And hope for the best. Logan sighed, rubbing his temples in sudden exhaustion, despite the fact it was only just now creeping up on midnight.",0,1,0,1,0
I'll explain myself...,0,1,0,0,0
I shook my head.,0,0,0,0,0
